{
  "message": "It's urgent  A student in Uttara has been shot in the head. Urgently need A-negative blood.   Please find an A-negative donor in Uttara.  Contact: 01793117664 (Sumon) Patient's Name: Tamim. Hospital: Uttara Lab Aid, Sector 6 Blood Type: A- negative.\nTahia forwarded a message\nTahia Samiha Idika\n106.Please spread this\nIt's urgent\n\nA student in Uttara has been shot in the head. Urgently need A-negative blood. \n\nPlease find an A-negative donor in Uttara.\n\nContact: 01793117664 (Sumon)\nPatient's Name: Tamim.\nHospital: Uttara Lab Aid, Sector 6\nBlood Type: A-negative.\n\n@everyone kindly help if you can.",
  "blood_group": "A-",
  "bags_needed": "1",
  "patient": {
    "name": "Tamim",
    "gender": "",
    "age_group": ""
  },
  "condition": "Shot in the head",
  "location": "Uttara Lab Aid, Sector 6",
  "hospital_name": "Uttara Lab Aid, Sector 6",
  "location_markers": [
    "Uttara"
  ],
  "probable_day": "",
  "probable_time": "",
  "contacts": [
    {
      "name": "Sumon",
      "contact_numbers": [
        "01793117664"
      ],
      "relation_with_patient": ""
    }
  ],
  "compensation": {
    "transportation": "",
    "allowance": ""
  }
}